{
  "id": "name_similarity",
  "op": "metric",
  "description": "Tokenized name similarity using cosine distance.",
  "inputs": [
    { "name": "left", "type": "field_ref" },
    { "name": "right", "type": "field_ref" }
  ],
  "outputs": [
    { "name": "score", "type": "similarity_score" }
  ],
  "config": {
    "method": "cosine",
    "tokenizer": "camel_case"
  }
}
