{
  "id": "video_scene_structure_similarity",
  "op": "metric",
  "description": "Shot/scene boundary similarity.",
  "inputs": [
    { "name": "left", "type": "volume_ref" },
    { "name": "right", "type": "volume_ref" }
  ],
  "outputs": [
    { "name": "similarity", "type": "semantic_score" }
  ],
  "config": {}
}
